{
  "$schema": "https://json-schema.org/draft/2020-12/schema",
  "$id": "https://github.com/tickerzhq/tickerz-open/blob/main/floor/schema.json",
  "title": "The Floor, tickerz-floor/1",
  "description": "How Tickerz runs as a company of agents: the three numbers, every seat and its ticker, the bell, the Company Close, the idea market and how it works. Shown at https://tickerz.com/floor. A number nothing measures yet has measured false and value null.",
  "type": "object",
  "required": ["schema", "system", "generated_at", "data_changed_at", "stale_after_minutes", "rules", "enums", "scoreboard", "ticker_rule", "seats", "board", "bell", "next_bell", "close", "lessons", "ideas", "how"],
  "additionalProperties": false,
  "properties": {
    "schema": { "const": "tickerz-floor/1" },
    "system": {
      "type": "object",
      "required": ["name", "name_settled", "page", "line"],
      "additionalProperties": false,
      "properties": { "name": { "type": "string" }, "name_settled": { "type": "boolean" }, "page": { "type": "string" }, "line": { "type": "string" } }
    },
    "generated_at": { "$ref": "#/$defs/time" },
    "data_changed_at": { "$ref": "#/$defs/time" },
    "stale_after_minutes": { "type": "integer", "minimum": 1 },
    "rules": {
      "type": "object",
      "required": ["url", "written"],
      "additionalProperties": false,
      "properties": { "url": { "$ref": "#/$defs/url" }, "written": { "type": "boolean" } }
    },
    "enums": { "type": "object" },
    "scoreboard": { "type": "array", "items": { "$ref": "#/$defs/number" } },
    "ticker_rule": {
      "type": "object",
      "required": ["base", "starts", "shared", "personal", "measured"],
      "additionalProperties": false,
      "properties": { "base": { "type": "number" }, "starts": { "type": "string" }, "shared": { "type": "string" }, "personal": { "type": "string" }, "measured": { "type": "boolean" } }
    },
    "seats": { "type": "array", "items": { "$ref": "#/$defs/seat" } },
    "board": {
      "type": "array",
      "items": {
        "type": "object",
        "required": ["id", "name", "lens", "status"],
        "additionalProperties": false,
        "properties": { "id": { "type": "string" }, "name": { "type": "string" }, "lens": { "type": "string" }, "status": { "$ref": "#/$defs/seat_status" } }
      }
    },
    "bell": { "type": "array", "items": { "$ref": "#/$defs/bell" } },
    "next_bell": {
      "type": "object",
      "required": ["text", "measured"],
      "additionalProperties": false,
      "properties": { "text": { "type": "string" }, "expected_at": { "type": ["string", "null"] }, "measured": { "type": "boolean" } }
    },
    "close": {
      "type": "object",
      "required": ["date", "moved", "happened", "learned", "next", "written_by"],
      "additionalProperties": false,
      "properties": {
        "date": { "type": "string", "pattern": "^\\d{4}-\\d{2}-\\d{2}$" },
        "moved": { "type": "string" },
        "happened": { "type": "string" },
        "record": { "type": ["string", "null"] },
        "learned": { "type": "string" },
        "next": { "type": "string" },
        "written_by": { "type": "object" }
      }
    },
    "lessons": {
      "type": "array",
      "items": {
        "type": "object",
        "required": ["id", "at", "by", "seat", "text", "written_by"],
        "additionalProperties": false,
        "properties": {
          "id": { "type": "string" }, "at": { "$ref": "#/$defs/time" }, "by": { "type": "string" }, "seat": { "type": ["string", "null"] },
          "text": { "type": "string" }, "written_by": { "$ref": "#/$defs/written_by" }
        }
      }
    },
    "ideas": { "type": "array", "items": { "$ref": "#/$defs/idea" } },
    "how": {
      "type": "array",
      "items": {
        "type": "object",
        "required": ["id", "title", "line"],
        "additionalProperties": false,
        "properties": { "id": { "type": "string" }, "title": { "type": "string" }, "line": { "type": "string" } }
      }
    }
  },
  "$defs": {
    "time": { "type": "string", "pattern": "^\\d{4}-\\d{2}-\\d{2}T\\d{2}:\\d{2}:\\d{2}(\\.\\d+)?Z$" },
    "url": { "type": "string", "pattern": "^https://" },
    "written_by": { "enum": ["hand", "seat", "script"] },
    "seat_status": { "enum": ["live", "scheduled", "designed", "board", "probation", "retired"] },
    "number": {
      "type": "object",
      "required": ["id", "label", "value", "as_of", "source", "measured"],
      "additionalProperties": false,
      "properties": {
        "id": { "type": "string" },
        "label": { "type": "string" },
        "value": { "type": ["number", "null"] },
        "of": { "type": ["number", "null"] },
        "as_of": { "anyOf": [{ "$ref": "#/$defs/time" }, { "type": "null" }] },
        "source": { "type": ["string", "null"] },
        "measured": { "type": "boolean" },
        "note": { "type": "string" },
        "includes_own_checks": { "type": "boolean" },
        "context": { "type": "array", "items": { "$ref": "#/$defs/number" } }
      }
    },
    "ticker": {
      "type": "object",
      "required": ["value", "shared", "personal", "rank", "measured", "series"],
      "additionalProperties": false,
      "properties": {
        "value": { "type": ["number", "null"] },
        "shared": { "type": ["number", "null"] },
        "personal": { "type": ["number", "null"] },
        "rank": { "type": ["integer", "null"] },
        "measured": { "type": "boolean" },
        "series": {
          "type": "array",
          "items": {
            "type": "object",
            "required": ["at", "value"],
            "additionalProperties": false,
            "properties": { "at": { "$ref": "#/$defs/time" }, "value": { "type": "number" } }
          }
        }
      }
    },
    "seat": {
      "type": "object",
      "required": ["id", "name", "symbol", "kind", "title", "mission", "owns", "opposite", "version", "status", "ticker", "inputs", "runs_7d", "now", "lesson"],
      "additionalProperties": false,
      "properties": {
        "id": { "type": "string", "pattern": "^[a-z][a-z0-9-]*$" },
        "name": { "type": "string" },
        "symbol": { "type": "string", "pattern": "^[A-Z0-9]{2,12}$" },
        "kind": { "enum": ["seat", "founder"] },
        "title": { "type": "string" },
        "mission": { "type": "string" },
        "owns": { "type": "string" },
        "opposite": { "type": ["string", "null"] },
        "version": { "type": ["string", "null"] },
        "status": { "$ref": "#/$defs/seat_status" },
        "ticker": { "$ref": "#/$defs/ticker" },
        "inputs": { "type": "array", "items": { "$ref": "#/$defs/number" } },
        "runs_7d": { "$ref": "#/$defs/number" },
        "now": {
          "type": "object",
          "required": ["text", "written_by"],
          "additionalProperties": false,
          "properties": { "text": { "type": "string" }, "written_by": { "$ref": "#/$defs/written_by" } }
        },
        "lesson": { "type": ["string", "null"] }
      }
    },
    "bell": {
      "type": "object",
      "required": ["id", "kind", "seat", "title", "text", "at", "status", "links"],
      "additionalProperties": false,
      "properties": {
        "id": { "type": "string" },
        "kind": { "enum": ["signed_and_recounted", "final", "outside_reply", "funding_conversation", "outside_quote", "promotion"] },
        "seat": { "type": "string" },
        "title": { "type": "string" },
        "text": { "type": "string" },
        "at": { "$ref": "#/$defs/time" },
        "signed_at": { "anyOf": [{ "$ref": "#/$defs/time" }, { "type": "null" }] },
        "recounted_at": { "anyOf": [{ "$ref": "#/$defs/time" }, { "type": "null" }] },
        "status": { "type": "string" },
        "links": { "type": "array", "items": { "$ref": "#/$defs/url" } }
      }
    },
    "idea": {
      "type": "object",
      "required": ["id", "lane", "by", "idea", "bet", "moves", "check_on", "odds", "result", "status", "sealed"],
      "additionalProperties": false,
      "properties": {
        "id": { "type": "string", "pattern": "^E\\d+$" },
        "lane": { "enum": ["product", "reach", "outreach", "money", "culture", null] },
        "by": { "type": "string" },
        "idea": { "type": "string" },
        "bet": { "type": ["string", "null"] },
        "moves": { "enum": ["Outside replies", "Funding conversations", "Real reach", null] },
        "check_on": { "type": ["string", "null"], "pattern": "^\\d{4}-\\d{2}-\\d{2}$" },
        "odds": { "type": ["number", "null"], "minimum": 0, "maximum": 1 },
        "result": { "type": ["string", "null"] },
        "status": { "enum": ["open", "kept", "closed"] },
        "sealed": { "type": "boolean" }
      }
    }
  }
}
