{
  "schema": "tickerz-floor/1",
  "system": {
    "name": "Tickerz Gigabrain",
    "name_settled": false,
    "page": "The Floor",
    "line": "Everything gets a ticker."
  },
  "generated_at": "2026-10-09T20:35:48Z",
  "data_changed_at": "2026-10-09T20:35:48Z",
  "stale_after_minutes": 180,
  "rules": {
    "url": "https://github.com/tickerzhq/tickerz-open/blob/main/floor/RULES.md",
    "written": true
  },
  "enums": {
    "seat_status": {
      "live": "a routine does this seat's work today under its pre-design prompt (version -v0)",
      "scheduled": "first run is booked",
      "designed": "not running yet",
      "board": "board seat",
      "probation": "new version on trial",
      "retired": "version replaced, archived word for word"
    },
    "idea_by": "a seat id, founder, or house (work from before the seats existed)",
    "idea_lane": [
      "product",
      "reach",
      "outreach",
      "money",
      "culture"
    ],
    "idea_status": [
      "open",
      "kept",
      "closed"
    ],
    "bell_kind": [
      "signed_and_recounted",
      "final",
      "outside_reply",
      "funding_conversation",
      "outside_quote",
      "promotion"
    ],
    "written_by": {
      "hand": "written by a person or session for v1",
      "seat": "the seat's own public line",
      "script": "built by the exporter from records"
    }
  },
  "scoreboard": [
    {
      "id": "outside_replies",
      "label": "Outside people who replied or named a number",
      "value": 0,
      "as_of": "2026-10-09T19:59:28Z",
      "source": "private record",
      "measured": true
    },
    {
      "id": "funding_conversations",
      "label": "Funding conversations",
      "value": 0,
      "as_of": "2026-10-09T19:59:28Z",
      "source": "private record",
      "measured": true
    },
    {
      "id": "real_reach",
      "label": "Real reach",
      "value": null,
      "as_of": null,
      "source": null,
      "measured": false,
      "note": "Outside quotes of a Tickerz number are not counted yet. Shown beside it, never scored:",
      "context": [
        {
          "id": "visitors_week",
          "label": "Visitors, Oct 5 to 9",
          "value": 106,
          "as_of": "2026-10-09T19:59:28Z",
          "source": "private record",
          "measured": true,
          "includes_own_checks": true
        },
        {
          "id": "followers",
          "label": "Followers on @tickerzhq",
          "value": 380,
          "as_of": "2026-10-09T19:59:28Z",
          "source": "https://x.com/tickerzhq",
          "measured": true
        }
      ]
    }
  ],
  "ticker_rule": {
    "base": 100,
    "starts": "the first season, when the scorer runs",
    "shared": "the company's three numbers, the same for every seat",
    "personal": "events on the seat's own number, plus how well its stated odds came true",
    "measured": false
  },
  "seats": [
    {
      "id": "oracle",
      "name": "Oracle",
      "symbol": "ORACLE",
      "kind": "seat",
      "title": "Product engine",
      "mission": "Every due number signs on time from a clean source.",
      "owns": "Signed numbers made final on schedule",
      "opposite": "receipts",
      "version": "oracle-v0",
      "status": "live",
      "ticker": {
        "value": null,
        "shared": null,
        "personal": null,
        "rank": null,
        "measured": false,
        "series": []
      },
      "inputs": [
        {
          "id": "signed_numbers",
          "label": "Numbers signed, not final yet",
          "value": 2,
          "as_of": "2026-10-09T20:35:12.281Z",
          "source": "https://tickerz.com/signed",
          "measured": true
        },
        {
          "id": "forecast_record",
          "label": "Forecasts that landed inside their 80% range",
          "value": 7,
          "as_of": "2026-10-09T19:30:35Z",
          "source": "https://raw.githubusercontent.com/tickerzhq/tickerz-open/main/forecasts/latest.json",
          "measured": true,
          "of": 10
        }
      ],
      "runs_7d": {
        "id": "runs_7d",
        "label": "Runs in the last 7 days",
        "value": 45,
        "as_of": "2026-10-09T19:00:00Z",
        "source": "private record",
        "measured": true,
        "note": "three routines that become this seat; one of them counted from Oct 7 only"
      },
      "now": {
        "text": "Signed its first two numbers today, $LAYOFFS 170,732 and $MINTS 55,686. Next due: September CPI on Oct 14.",
        "written_by": "hand"
      },
      "lesson": "l2"
    },
    {
      "id": "receipts",
      "name": "Receipts",
      "symbol": "RECEIPTS",
      "kind": "seat",
      "title": "Chief of staff",
      "mission": "The founder never has to repeat himself.",
      "owns": "Times a week the founder re-explains something the brain already held (lower is better)",
      "opposite": "oracle",
      "version": "receipts-v0",
      "status": "live",
      "ticker": {
        "value": null,
        "shared": null,
        "personal": null,
        "rank": null,
        "measured": false,
        "series": []
      },
      "inputs": [],
      "runs_7d": {
        "id": "runs_7d",
        "label": "Runs in the last 7 days",
        "value": 6,
        "as_of": "2026-10-09T19:00:00Z",
        "source": "private record",
        "measured": true
      },
      "now": {
        "text": "Keeps the founder's own words in the brain within the hour and writes the 7 AM brief.",
        "written_by": "hand"
      },
      "lesson": "l4"
    },
    {
      "id": "tape",
      "name": "Tape",
      "symbol": "TAPE",
      "kind": "seat",
      "title": "Reach",
      "mission": "Outside people find and quote Tickerz numbers.",
      "owns": "Outside quotes of a Tickerz number, per week",
      "opposite": "desk",
      "version": "tape-v0",
      "status": "live",
      "ticker": {
        "value": null,
        "shared": null,
        "personal": null,
        "rank": null,
        "measured": false,
        "series": []
      },
      "inputs": [],
      "runs_7d": {
        "id": "runs_7d",
        "label": "Runs in the last 7 days",
        "value": 5,
        "as_of": "2026-10-09T19:00:00Z",
        "source": "private record",
        "measured": true
      },
      "now": {
        "text": "Sends post ideas to the founder instead of posting. He has posted one so far.",
        "written_by": "hand"
      },
      "lesson": null
    },
    {
      "id": "recount",
      "name": "Recount",
      "symbol": "RECOUNT",
      "kind": "seat",
      "title": "Research and data",
      "mission": "True numbers the other seats can use, from clean sources.",
      "owns": "Findings used outside the company",
      "opposite": "proof",
      "version": "recount-v0",
      "status": "live",
      "ticker": {
        "value": null,
        "shared": null,
        "personal": null,
        "rank": null,
        "measured": false,
        "series": []
      },
      "inputs": [],
      "runs_7d": {
        "id": "runs_7d",
        "label": "Runs in the last 7 days",
        "value": 7,
        "as_of": "2026-10-09T19:00:00Z",
        "source": "private record",
        "measured": true
      },
      "now": {
        "text": "Agent Economy Report #2 prints Oct 11.",
        "written_by": "hand"
      },
      "lesson": "l1"
    },
    {
      "id": "proof",
      "name": "Proof",
      "symbol": "PROOF",
      "kind": "seat",
      "title": "Design and quality",
      "mission": "Nothing public ships below the bar.",
      "owns": "Items it passed that were later rejected, per 30 days (lower is better)",
      "opposite": "recount",
      "version": "proof-v0",
      "status": "live",
      "ticker": {
        "value": null,
        "shared": null,
        "personal": null,
        "rank": null,
        "measured": false,
        "series": []
      },
      "inputs": [],
      "runs_7d": {
        "id": "runs_7d",
        "label": "Runs in the last 7 days",
        "value": 3,
        "as_of": "2026-10-09T19:00:00Z",
        "source": "private record",
        "measured": true
      },
      "now": {
        "text": "Checked all 17 pages at phone and desktop width today: nothing scrolls sideways, scores 15 to 16 of 18.",
        "written_by": "hand"
      },
      "lesson": null
    },
    {
      "id": "treasury",
      "name": "Treasury",
      "symbol": "TREASURY",
      "kind": "seat",
      "title": "Money in",
      "mission": "Funding conversations with funds, accelerators and grant programs.",
      "owns": "Funding conversations",
      "opposite": "issue",
      "version": "treasury-v0",
      "status": "live",
      "ticker": {
        "value": null,
        "shared": null,
        "personal": null,
        "rank": null,
        "measured": false,
        "series": []
      },
      "inputs": [],
      "runs_7d": {
        "id": "runs_7d",
        "label": "Runs in the last 7 days",
        "value": 8,
        "as_of": "2026-10-09T19:00:00Z",
        "source": "private record",
        "measured": true
      },
      "now": {
        "text": "Drafts only. The founder submits everything.",
        "written_by": "hand"
      },
      "lesson": null
    },
    {
      "id": "issue",
      "name": "Issue",
      "symbol": "ISSUE",
      "kind": "seat",
      "title": "Culture and collabs",
      "mission": "Tickerz inside culture: athletes, brands, makers, media and events.",
      "owns": "Replies from named culture targets",
      "opposite": "treasury",
      "version": "issue-v0",
      "status": "scheduled",
      "ticker": {
        "value": null,
        "shared": null,
        "personal": null,
        "rank": null,
        "measured": false,
        "series": []
      },
      "inputs": [],
      "runs_7d": {
        "id": "runs_7d",
        "label": "Runs in the last 7 days",
        "value": 0,
        "as_of": "2026-10-09T19:00:00Z",
        "source": "private record",
        "measured": true
      },